{
  "role_id": "SDD",
  "role_name": "Software Developer for Sustainability",
  "eqf_level": 4,
  "description": "Implements sustainable coding practices and develops eco-efficient applications",
  "main_area": "Software Development",
  "thematic_area": "sustainability",
  "program_duration": 2,
  "learning_outcomes": [
    "Use user experience to enhance environmental performance",
    "Implement user experience in circular economy applications",
    "Apply sustainable design to enhance environmental performance",
    "Explain accessible interfaces to enhance environmental performance",
    "Use energy-efficient interfaces to enhance environmental performance",
    "Describe sustainable design to support sustainable development goals",
    "Perform user experience to enhance environmental performance",
    "Describe ethical design principles to support sustainable development goals",
    "Apply integrated knowledge of sustainable design, ethical design principles to solve complex sustainability challenges"
  ],
  "skills": [
    "low-impact interface design",
    "user research for sustainability",
    "design systems optimization",
    "sustainable design principles",
    "carbon footprint calculation",
    "sustainability frameworks application"
  ],
  "competencies": [
    "Capability in applying energy-efficient digital design",
    "Capability in applying sustainable user experience development",
    "Capability in applying accessibility implementation",
    "Capability in applying sustainable design systems management",
    "Capability in applying ethical design principles application",
    "Proficiency in applying digital tools for sustainability assessment",
    "Ability to analyze and interpret sustainability data for applying decision-making",
    "Capacity to communicate sustainability concepts to diverse stakeholders",
    "Skill in applying sustainable development frameworks in digital contexts"
  ],
  "target_ects": 60,
  "assessment_methods": [
    "practical_assignments",
    "portfolio",
    "skills_demonstrations"
  ],
  "career_pathways": [
    "Sustainable Design Systems Architect",
    "Ethical Design Director",
    "Chief Sustainable Design Officer",
    "Sustainable Design Consultant",
    "Independent Sustainability Consultant",
    "Sustainability Educator/Trainer"
  ]
}