{
  "role_id": "SBA",
  "role_name": "Sustainability Business Analyst",
  "eqf_level": 7,
  "description": "Analyzes business processes and sustainability performance metrics",
  "main_area": "Analysis",
  "thematic_area": "sustainability",
  "program_duration": 4,
  "learning_outcomes": [
    "Evaluate process optimization to support sustainable development goals",
    "Lead process optimization for addressing environmental challenges",
    "Create sustainable business models in organizational sustainability contexts",
    "Design impact assessment for addressing environmental challenges",
    "Create impact assessment in circular economy applications",
    "Integrate impact assessment for addressing environmental challenges",
    "Lead data-driven decision making to support sustainable development goals",
    "Lead transformative initiatives in process optimization, data-driven decision making that advance the field of digital sustainability"
  ],
  "skills": [
    "impact data collection",
    "sustainable value chain mapping",
    "sustainable business model analysis",
    "process efficiency analysis",
    "metrics development",
    "sustainability requirements analysis",
    "sustainable development goals alignment",
    "stakeholder communication",
    "sustainability frameworks application"
  ],
  "competencies": [
    "Capability in leading sustainability requirements analysis",
    "Capability in leading sustainable business process modeling",
    "Capability in leading impact data collection and validation",
    "Capability in leading sustainable value chain analysis",
    "Capability in leading sustainability metrics development",
    "Proficiency in leading digital tools for sustainability assessment",
    "Ability to analyze and interpret sustainability data for leading decision-making",
    "Capacity to communicate sustainability concepts to diverse stakeholders",
    "Skill in leading sustainable development frameworks in digital contexts"
  ],
  "target_ects": 120,
  "assessment_methods": [
    "research_papers",
    "project_work",
    "thesis",
    "presentations",
    "portfolios"
  ],
  "career_pathways": [
    "Senior Sustainability Analyst",
    "Sustainability Requirements Lead",
    "Sustainable Business Transformation Analyst",
    "ESG Business Analysis Manager",
    "Independent Sustainability Consultant",
    "ESG Integration Specialist",
    "Sustainability Educator/Trainer"
  ]
}