{
  "role_id": "SSD",
  "role_name": "Sustainable Solution Designer",
  "eqf_level": 7,
  "description": "Designs IT architectures and systems with sustainability as a core principle",
  "main_area": "Design",
  "thematic_area": "sustainability",
  "program_duration": 4,
  "learning_outcomes": [
    "Formulate lifecycle optimization in digital transformation for sustainability",
    "Lead green coding in organizational sustainability contexts",
    "Develop sustainable software architectures to enhance environmental performance",
    "Create green coding in organizational sustainability contexts",
    "Synthesize lifecycle optimization to support sustainable development goals",
    "Create energy-efficient software to support sustainable development goals",
    "Lead transformative initiatives in green coding, sustainable software architectures that advance the field of digital sustainability"
  ],
  "skills": [
    "code refactoring for sustainability",
    "software carbon intensity (SCI) calculation",
    "energy-efficient code optimization",
    "sustainable development practices",
    "green software architecture",
    "energy profiling",
    "digital sustainability assessment",
    "sustainability frameworks application",
    "environmental impact assessment"
  ],
  "competencies": [
    "Capability in leading sustainable software lifecycle management",
    "Capability in leading green code development and optimization",
    "Capability in leading environmental impact assessment of software",
    "Capability in leading sustainable development methodologies",
    "Capability in leading technical debt management for sustainability",
    "Proficiency in leading digital tools for sustainability assessment",
    "Ability to analyze and interpret sustainability data for leading decision-making",
    "Capacity to communicate sustainability concepts to diverse stakeholders",
    "Skill in leading sustainable development frameworks in digital contexts"
  ],
  "target_ects": 120,
  "assessment_methods": [
    "research_papers",
    "project_work",
    "thesis",
    "presentations",
    "portfolios"
  ],
  "career_pathways": [
    "Lead Green Software Engineer",
    "Sustainable Software Architect",
    "Green Code Optimization Specialist",
    "Sustainable Development Team Lead",
    "Sustainable Innovation Entrepreneur",
    "ESG Integration Specialist",
    "Digital Sustainability Researcher"
  ]
}