{
  "role_id": "SSD",
  "role_name": "Sustainable Solution Designer",
  "eqf_level": 6,
  "description": "Designs IT architectures and systems with sustainability as a core principle",
  "main_area": "Design",
  "thematic_area": "sustainability",
  "program_duration": 6,
  "learning_outcomes": [
    "Optimize energy-efficient software for sustainable business practices",
    "Develop green coding in circular economy applications",
    "Compare circular software design in digital transformation for sustainability",
    "Evaluate energy-efficient software to enhance environmental performance",
    "Assess lifecycle optimization for sustainable business practices",
    "Compare circular software design in circular economy applications",
    "Assess energy-efficient software to support sustainable development goals",
    "Apply integrated knowledge of green coding, lifecycle optimization to solve complex sustainability challenges"
  ],
  "skills": [
    "sustainable development practices",
    "energy profiling",
    "energy-efficient code optimization",
    "code refactoring for sustainability",
    "lifecycle optimization",
    "sustainability frameworks application",
    "sustainable development goals alignment",
    "carbon footprint calculation"
  ],
  "competencies": [
    "Capability in developing sustainable software lifecycle management",
    "Capability in developing green code development and optimization",
    "Capability in developing environmental impact assessment of software",
    "Capability in developing sustainable development methodologies",
    "Capability in developing technical debt management for sustainability",
    "Proficiency in developing digital tools for sustainability assessment",
    "Ability to analyze and interpret sustainability data for developing decision-making",
    "Capacity to communicate sustainability concepts to diverse stakeholders",
    "Skill in developing sustainable development frameworks in digital contexts"
  ],
  "target_ects": 180,
  "assessment_methods": [
    "exams",
    "project_work",
    "thesis",
    "case_studies",
    "reports"
  ],
  "career_pathways": [
    "Green Code Optimization Specialist",
    "Sustainable Development Team Lead",
    "Chief Green Code Officer",
    "Sustainable Software Consultant",
    "Digital Sustainability Researcher",
    "Sustainability Educator/Trainer"
  ]
}