{
  "role_id": "DSE",
  "role_name": "Data Engineer",
  "eqf_level": 6,
  "description": "Implements and optimizes digital infrastructure with minimal environmental impact",
  "main_area": "Data",
  "thematic_area": "sustainability",
  "program_duration": 6,
  "learning_outcomes": [
    "Analyze systems design for addressing environmental challenges",
    "Compare systems design in digital transformation for sustainability",
    "Assess infrastructure optimization in organizational sustainability contexts",
    "Solve systems design for sustainable business practices",
    "Evaluate technical implementation for addressing environmental challenges",
    "Develop resource management in organizational sustainability contexts",
    "Apply integrated knowledge of energy efficiency, technical implementation to solve complex sustainability challenges"
  ],
  "skills": [
    "sustainable IT infrastructure",
    "renewable energy integration",
    "energy-efficient systems design",
    "power usage effectiveness optimization",
    "carbon-aware infrastructure",
    "sustainable development goals alignment",
    "sustainability frameworks application",
    "environmental impact assessment"
  ],
  "competencies": [
    "Capability in developing sustainable systems architecture",
    "Capability in developing energy-efficient infrastructure design",
    "Capability in developing circular design principles application",
    "Capability in developing technical sustainability implementation",
    "Capability in developing resource optimization engineering",
    "Proficiency in developing digital tools for sustainability assessment",
    "Ability to analyze and interpret sustainability data for developing decision-making",
    "Capacity to communicate sustainability concepts to diverse stakeholders",
    "Skill in developing sustainable development frameworks in digital contexts"
  ],
  "target_ects": 180,
  "assessment_methods": [
    "exams",
    "project_work",
    "thesis",
    "case_studies",
    "reports"
  ],
  "career_pathways": [
    "Green IT Engineering Director",
    "Circular Systems Design Lead",
    "Energy Efficiency Engineering Consultant",
    "Chief Sustainable Technology Officer",
    "Sustainability Educator/Trainer",
    "Digital Sustainability Researcher"
  ]
}