{
  "role_id": "DSE",
  "role_name": "Data Engineer",
  "eqf_level": 7,
  "description": "Implements and optimizes digital infrastructure with minimal environmental impact",
  "main_area": "Data",
  "thematic_area": "sustainability",
  "program_duration": 4,
  "learning_outcomes": [
    "Evaluate technical implementation to support sustainable development goals",
    "Lead infrastructure optimization in organizational sustainability contexts",
    "Lead technical implementation to enhance environmental performance",
    "Design infrastructure optimization to support sustainable development goals",
    "Synthesize infrastructure optimization for sustainable business practices",
    "Lead energy efficiency in circular economy applications",
    "Lead resource management in organizational sustainability contexts",
    "Develop systems design to support sustainable development goals",
    "Lead transformative initiatives in systems design, infrastructure optimization that advance the field of digital sustainability"
  ],
  "skills": [
    "power usage effectiveness optimization",
    "energy-efficient systems design",
    "renewable energy integration",
    "carbon-aware infrastructure",
    "green datacenter design",
    "sustainable IT infrastructure",
    "stakeholder communication",
    "carbon footprint calculation",
    "sustainability frameworks application"
  ],
  "competencies": [
    "Capability in leading sustainable systems architecture",
    "Capability in leading energy-efficient infrastructure design",
    "Capability in leading circular design principles application",
    "Capability in leading technical sustainability implementation",
    "Capability in leading resource optimization engineering",
    "Proficiency in leading digital tools for sustainability assessment",
    "Ability to analyze and interpret sustainability data for leading decision-making",
    "Capacity to communicate sustainability concepts to diverse stakeholders",
    "Skill in leading sustainable development frameworks in digital contexts"
  ],
  "target_ects": 120,
  "assessment_methods": [
    "research_papers",
    "project_work",
    "thesis",
    "presentations",
    "portfolios"
  ],
  "career_pathways": [
    "Lead Sustainability Systems Engineer",
    "Sustainable Infrastructure Architect",
    "Green IT Engineering Director",
    "Circular Systems Design Lead",
    "Sustainability Educator/Trainer",
    "ESG Integration Specialist",
    "Independent Sustainability Consultant"
  ]
}