{
  "role_id": "DSC",
  "role_name": "Digital Sustainability Consultant",
  "eqf_level": 6,
  "description": "Provides advisory services on digital sustainability strategies",
  "main_area": "Advisory",
  "thematic_area": "sustainability",
  "program_duration": 6,
  "learning_outcomes": [
    "Solve transformation guidance to support sustainable development goals",
    "Evaluate best practices implementation for sustainable business practices",
    "Implement best practices implementation in circular economy applications",
    "Implement best practices implementation in organizational sustainability contexts",
    "Analyze best practices implementation in organizational sustainability contexts",
    "Compare strategic advising for addressing environmental challenges",
    "Apply integrated knowledge of transformation guidance, sustainability consulting to solve complex sustainability challenges"
  ],
  "skills": [
    "strategic sustainability consulting",
    "sustainability reporting",
    "sustainability assessment methodologies",
    "ESG integration frameworks",
    "digital sustainability auditing",
    "environmental impact assessment",
    "lifecycle thinking application",
    "sustainable development goals alignment"
  ],
  "competencies": [
    "Capability in developing sustainability assessment and auditing",
    "Capability in developing strategic sustainability consulting",
    "Capability in developing transformation roadmap development",
    "Capability in developing sustainability framework implementation",
    "Capability in developing ESG integration consulting",
    "Proficiency in developing digital tools for sustainability assessment",
    "Ability to analyze and interpret sustainability data for developing decision-making",
    "Capacity to communicate sustainability concepts to diverse stakeholders",
    "Skill in developing sustainable development frameworks in digital contexts"
  ],
  "target_ects": 180,
  "assessment_methods": [
    "exams",
    "project_work",
    "thesis",
    "case_studies",
    "reports"
  ],
  "career_pathways": [
    "ESG Transformation Director",
    "Partner in Sustainability Practice",
    "Sustainability Strategy Executive",
    "Chief Sustainability Advisor",
    "Sustainable Innovation Entrepreneur",
    "Sustainability Educator/Trainer"
  ]
}