{
  "role_id": "DSL",
  "role_name": "Digital Sustainability Lead",
  "eqf_level": 7,
  "description": "Drives digital sustainability initiatives within organizations",
  "main_area": "Management",
  "thematic_area": "sustainability",
  "program_duration": 4,
  "learning_outcomes": [
    "Lead leadership for sustainable business practices",
    "Synthesize strategic planning to enhance environmental performance",
    "Critique sustainability integration to support sustainable development goals",
    "Design stakeholder management in organizational sustainability contexts",
    "Develop leadership in organizational sustainability contexts",
    "Develop leadership for sustainable business practices",
    "Create stakeholder management for sustainable business practices",
    "Lead transformative initiatives in strategic planning, sustainability integration that advance the field of digital sustainability"
  ],
  "skills": [
    "sustainability strategy development",
    "digital transformation planning",
    "ESG reporting",
    "stakeholder engagement",
    "green IT governance",
    "change management",
    "circular economy principles application",
    "environmental impact assessment",
    "stakeholder communication"
  ],
  "competencies": [
    "Capability in leading strategic sustainability leadership",
    "Capability in leading digital transformation governance",
    "Capability in leading organizational change management",
    "Capability in leading sustainability integration in digital strategy",
    "Capability in leading cross-functional stakeholder engagement",
    "Proficiency in leading digital tools for sustainability assessment",
    "Ability to analyze and interpret sustainability data for leading decision-making",
    "Capacity to communicate sustainability concepts to diverse stakeholders",
    "Skill in leading sustainable development frameworks in digital contexts"
  ],
  "target_ects": 120,
  "assessment_methods": [
    "research_papers",
    "project_work",
    "thesis",
    "presentations",
    "portfolios"
  ],
  "career_pathways": [
    "Chief Sustainability Officer",
    "Head of Digital Sustainability",
    "Sustainability Transformation Lead",
    "Digital Sustainability Director",
    "Digital Sustainability Researcher",
    "ESG Integration Specialist",
    "Sustainable Innovation Entrepreneur"
  ]
}