{
  "role_id": "SDD",
  "role_name": "Software Developer for Sustainability",
  "eqf_level": 6,
  "description": "Implements sustainable coding practices and develops eco-efficient applications",
  "main_area": "Software Development",
  "thematic_area": "sustainability",
  "program_duration": 6,
  "learning_outcomes": [
    "Develop accessible interfaces for addressing environmental challenges",
    "Solve accessible interfaces for addressing environmental challenges",
    "Analyze user experience in circular economy applications",
    "Optimize energy-efficient interfaces to support sustainable development goals",
    "Compare sustainable design to support sustainable development goals",
    "Assess ethical design principles in organizational sustainability contexts",
    "Apply integrated knowledge of ethical design principles, user experience to solve complex sustainability challenges"
  ],
  "skills": [
    "user research for sustainability",
    "accessibility implementation",
    "sustainable design principles",
    "design systems optimization",
    "energy-efficient UI/UX design",
    "digital sustainability assessment",
    "circular economy principles application",
    "carbon footprint calculation"
  ],
  "competencies": [
    "Capability in developing energy-efficient digital design",
    "Capability in developing sustainable user experience development",
    "Capability in developing accessibility implementation",
    "Capability in developing sustainable design systems management",
    "Capability in developing ethical design principles application",
    "Proficiency in developing digital tools for sustainability assessment",
    "Ability to analyze and interpret sustainability data for developing decision-making",
    "Capacity to communicate sustainability concepts to diverse stakeholders",
    "Skill in developing sustainable development frameworks in digital contexts"
  ],
  "target_ects": 180,
  "assessment_methods": [
    "exams",
    "project_work",
    "thesis",
    "case_studies",
    "reports"
  ],
  "career_pathways": [
    "Green UX Research Lead",
    "Sustainable Design Systems Architect",
    "Ethical Design Director",
    "Chief Sustainable Design Officer",
    "ESG Integration Specialist",
    "Independent Sustainability Consultant"
  ]
}