{
  "role_id": "STS",
  "role_name": "Sustainability Technical Specialist",
  "eqf_level": 5,
  "description": "Provides specialized technical support for sustainability tools and platforms",
  "main_area": "Technical Implementation",
  "thematic_area": "sustainability",
  "program_duration": 4,
  "learning_outcomes": [
    "Apply sustainable technologies for sustainable business practices",
    "Apply technology assessment for sustainable business practices",
    "Compare technology assessment in circular economy applications",
    "Solve technology assessment for sustainable business practices",
    "Analyze environmental impact reduction in circular economy applications",
    "Apply environmental impact reduction in circular economy applications",
    "Apply integrated knowledge of technical consulting, green IT to solve complex sustainability challenges"
  ],
  "skills": [
    "sustainable hardware evaluation",
    "green technology assessment",
    "e-waste reduction strategies",
    "sustainable IT solutions design",
    "carbon footprint calculation",
    "sustainability frameworks application",
    "lifecycle thinking application"
  ],
  "competencies": [
    "Capability in implementing green technology evaluation",
    "Capability in implementing sustainable IT solutions design",
    "Capability in implementing environmental impact assessment of technology",
    "Capability in implementing circular technology implementation",
    "Capability in implementing technology sustainability consulting",
    "Proficiency in implementing digital tools for sustainability assessment",
    "Ability to analyze and interpret sustainability data for implementing decision-making",
    "Capacity to communicate sustainability concepts to diverse stakeholders",
    "Skill in implementing sustainable development frameworks in digital contexts"
  ],
  "target_ects": 120,
  "assessment_methods": [
    "practical_assignments",
    "portfolio",
    "project_work",
    "case_studies"
  ],
  "career_pathways": [
    "Circular IT Implementation Lead",
    "Green Technology Assessment Lead",
    "Chief Green Technology Officer",
    "Sustainable Technology Research Lead",
    "ESG Integration Specialist",
    "Digital Sustainability Researcher"
  ]
}