{
  "role_id": "DAN",
  "role_name": "Data Analyst",
  "eqf_level": 7,
  "description": "Analyzes and visualizes data to drive sustainability insights and reporting",
  "main_area": "Data",
  "thematic_area": "sustainability",
  "program_duration": 4,
  "learning_outcomes": [
    "Create data-driven insights to support sustainable development goals",
    "Create metrics development in organizational sustainability contexts",
    "Evaluate metrics development for addressing environmental challenges",
    "Develop data-driven insights for addressing environmental challenges",
    "Synthesize metrics development for sustainable business practices",
    "Develop data analysis in organizational sustainability contexts",
    "Lead transformative initiatives in metrics development, data analysis that advance the field of digital sustainability"
  ],
  "skills": [
    "sustainability data modeling",
    "ESG metrics development",
    "sustainability reporting automation",
    "data-driven sustainability optimization",
    "impact dashboard creation",
    "analytics tool development",
    "digital sustainability assessment",
    "circular economy principles application",
    "lifecycle thinking application"
  ],
  "competencies": [
    "Capability in leading sustainability data modeling and analysis",
    "Capability in leading ESG metrics framework development",
    "Capability in leading data-driven sustainability reporting",
    "Capability in leading analytical dashboard development",
    "Capability in leading impact assessment methodologies",
    "Proficiency in leading digital tools for sustainability assessment",
    "Ability to analyze and interpret sustainability data for leading decision-making",
    "Capacity to communicate sustainability concepts to diverse stakeholders",
    "Skill in leading sustainable development frameworks in digital contexts"
  ],
  "target_ects": 120,
  "assessment_methods": [
    "research_papers",
    "project_work",
    "thesis",
    "presentations",
    "portfolios"
  ],
  "career_pathways": [
    "Sustainability Analytics Lead",
    "ESG Data & Analytics Manager",
    "Sustainability Reporting Director",
    "Impact Measurement Lead",
    "Digital Sustainability Researcher",
    "Sustainable Innovation Entrepreneur",
    "Independent Sustainability Consultant"
  ]
}