{
  "role_id": "DSI",
  "role_name": "Data Scientist (Sustainability)",
  "eqf_level": 8,
  "description": "Applies advanced analytics and machine learning to address sustainability challenges",
  "main_area": "Data",
  "thematic_area": "sustainability",
  "program_duration": 6,
  "learning_outcomes": [
    "Transform sustainability metrics to support sustainable development goals",
    "Advance predictive modeling for addressing environmental challenges",
    "Transform predictive modeling in organizational sustainability contexts",
    "Formulate data analytics for addressing environmental challenges",
    "Innovate machine learning in digital transformation for sustainability",
    "Advance predictive modeling for sustainable business practices",
    "Create sustainability metrics for sustainable business practices",
    "Lead transformative initiatives in data analytics, impact assessment that advance the field of digital sustainability"
  ],
  "skills": [
    "lifecycle assessment modeling",
    "data visualization for sustainability",
    "carbon accounting",
    "predictive modeling for resource optimization",
    "machine learning for environmental impact",
    "sustainability data analytics",
    "impact assessment methodologies",
    "circular economy principles application",
    "stakeholder communication",
    "environmental impact assessment"
  ],
  "competencies": [
    "Capability in advancing sustainability data analysis and interpretation",
    "Capability in advancing environmental impact modeling",
    "Capability in advancing machine learning for sustainability optimization",
    "Capability in advancing data-driven decision support for sustainability",
    "Capability in advancing complex systems analysis for environmental impacts",
    "Proficiency in advancing digital tools for sustainability assessment",
    "Ability to analyze and interpret sustainability data for advancing decision-making",
    "Capacity to communicate sustainability concepts to diverse stakeholders",
    "Skill in advancing sustainable development frameworks in digital contexts"
  ],
  "target_ects": 180,
  "assessment_methods": [
    "dissertation",
    "publications",
    "research_projects",
    "academic_defense",
    "peer_review"
  ],
  "career_pathways": [
    "Lead Sustainability Data Scientist",
    "Sustainability Analytics Director",
    "ESG Data Science Lead",
    "Sustainability Impact Modeling Expert",
    "Independent Sustainability Consultant",
    "Sustainability Educator/Trainer",
    "Digital Sustainability Researcher"
  ]
}