{
  "role_id": "DSM",
  "role_name": "Digital Sustainability Manager",
  "eqf_level": 6,
  "description": "Implements and manages digital sustainability initiatives",
  "main_area": "Management",
  "thematic_area": "sustainability",
  "program_duration": 6,
  "learning_outcomes": [
    "Optimize sustainability strategy to enhance environmental performance",
    "Solve organizational change in organizational sustainability contexts",
    "Examine program management in circular economy applications",
    "Implement program management for sustainable business practices",
    "Optimize resource allocation in circular economy applications",
    "Analyze implementation oversight for sustainable business practices",
    "Apply integrated knowledge of sustainability strategy, program management to solve complex sustainability challenges"
  ],
  "skills": [
    "sustainable procurement",
    "sustainability team leadership",
    "sustainability program management",
    "carbon reduction management",
    "green IT budget allocation",
    "sustainability frameworks application",
    "circular economy principles application",
    "environmental impact assessment"
  ],
  "competencies": [
    "Capability in developing sustainable digital program management",
    "Capability in developing ESG performance monitoring and reporting",
    "Capability in developing sustainable digital operations oversight",
    "Capability in developing green IT resource management",
    "Capability in developing sustainability team coordination",
    "Proficiency in developing digital tools for sustainability assessment",
    "Ability to analyze and interpret sustainability data for developing decision-making",
    "Capacity to communicate sustainability concepts to diverse stakeholders",
    "Skill in developing sustainable development frameworks in digital contexts"
  ],
  "target_ects": 180,
  "assessment_methods": [
    "exams",
    "project_work",
    "thesis",
    "case_studies",
    "reports"
  ],
  "career_pathways": [
    "Digital Sustainability Executive",
    "ESG Operations Director",
    "Chief Sustainability Officer",
    "Sustainable Transformation Lead",
    "Digital Sustainability Researcher",
    "Sustainable Innovation Entrepreneur"
  ]
}