{
  "role_id": "DAN",
  "role_name": "Data Analyst",
  "eqf_level": 6,
  "description": "Analyzes and visualizes data to drive sustainability insights and reporting",
  "main_area": "Data",
  "thematic_area": "sustainability",
  "program_duration": 6,
  "learning_outcomes": [
    "Examine metrics development in organizational sustainability contexts",
    "Evaluate data analysis to enhance environmental performance",
    "Assess metrics development in circular economy applications",
    "Optimize data-driven insights in organizational sustainability contexts",
    "Analyze data-driven insights in digital transformation for sustainability",
    "Solve data analysis in digital transformation for sustainability",
    "Apply integrated knowledge of reporting, dashboard creation to solve complex sustainability challenges"
  ],
  "skills": [
    "sustainability data modeling",
    "sustainability reporting automation",
    "analytics tool development",
    "impact dashboard creation",
    "data-driven sustainability optimization",
    "stakeholder communication",
    "carbon footprint calculation",
    "sustainability frameworks application"
  ],
  "competencies": [
    "Capability in developing sustainability data modeling and analysis",
    "Capability in developing ESG metrics framework development",
    "Capability in developing data-driven sustainability reporting",
    "Capability in developing analytical dashboard development",
    "Capability in developing impact assessment methodologies",
    "Proficiency in developing digital tools for sustainability assessment",
    "Ability to analyze and interpret sustainability data for developing decision-making",
    "Capacity to communicate sustainability concepts to diverse stakeholders",
    "Skill in developing sustainable development frameworks in digital contexts"
  ],
  "target_ects": 180,
  "assessment_methods": [
    "exams",
    "project_work",
    "thesis",
    "case_studies",
    "reports"
  ],
  "career_pathways": [
    "Sustainability Reporting Director",
    "Impact Measurement Lead",
    "Chief Sustainability Data Officer",
    "Sustainability Intelligence Director",
    "Digital Sustainability Researcher",
    "Sustainability Educator/Trainer"
  ]
}