{
  "role_id": "DSM",
  "role_name": "Digital Sustainability Manager",
  "eqf_level": 7,
  "description": "Implements and manages digital sustainability initiatives",
  "main_area": "Management",
  "thematic_area": "sustainability",
  "program_duration": 4,
  "learning_outcomes": [
    "Develop organizational change for addressing environmental challenges",
    "Develop resource allocation to enhance environmental performance",
    "Critique program management in organizational sustainability contexts",
    "Evaluate resource allocation to enhance environmental performance",
    "Integrate implementation oversight in digital transformation for sustainability",
    "Create resource allocation for addressing environmental challenges",
    "Lead transformative initiatives in implementation oversight, organizational change that advance the field of digital sustainability"
  ],
  "skills": [
    "green IT budget allocation",
    "sustainability team leadership",
    "sustainability program management",
    "sustainable procurement",
    "carbon reduction management",
    "ESG performance monitoring",
    "sustainable development goals alignment",
    "digital sustainability assessment",
    "environmental impact assessment"
  ],
  "competencies": [
    "Capability in leading sustainable digital program management",
    "Capability in leading ESG performance monitoring and reporting",
    "Capability in leading sustainable digital operations oversight",
    "Capability in leading green IT resource management",
    "Capability in leading sustainability team coordination",
    "Proficiency in leading digital tools for sustainability assessment",
    "Ability to analyze and interpret sustainability data for leading decision-making",
    "Capacity to communicate sustainability concepts to diverse stakeholders",
    "Skill in leading sustainable development frameworks in digital contexts"
  ],
  "target_ects": 120,
  "assessment_methods": [
    "research_papers",
    "project_work",
    "thesis",
    "presentations",
    "portfolios"
  ],
  "career_pathways": [
    "Head of Sustainability",
    "Sustainability Program Director",
    "Digital Sustainability Executive",
    "ESG Operations Director",
    "Sustainable Innovation Entrepreneur",
    "Independent Sustainability Consultant",
    "Sustainability Educator/Trainer"
  ]
}