{
  "role_id": "STS",
  "role_name": "Sustainability Technical Specialist",
  "eqf_level": 4,
  "description": "Provides specialized technical support for sustainability tools and platforms",
  "main_area": "Technical Implementation",
  "thematic_area": "sustainability",
  "program_duration": 2,
  "learning_outcomes": [
    "Operate technical consulting for sustainable business practices",
    "Perform environmental impact reduction in circular economy applications",
    "Apply sustainable technologies for addressing environmental challenges",
    "Perform sustainable technologies to enhance environmental performance",
    "Demonstrate green IT to enhance environmental performance",
    "Describe green IT in digital transformation for sustainability",
    "Apply integrated knowledge of green IT, sustainable technologies to solve complex sustainability challenges"
  ],
  "skills": [
    "energy efficiency auditing",
    "sustainable hardware evaluation",
    "green technology assessment",
    "circular IT implementation",
    "stakeholder communication",
    "environmental impact assessment"
  ],
  "competencies": [
    "Capability in applying green technology evaluation",
    "Capability in applying sustainable IT solutions design",
    "Capability in applying environmental impact assessment of technology",
    "Capability in applying circular technology implementation",
    "Capability in applying technology sustainability consulting",
    "Proficiency in applying digital tools for sustainability assessment",
    "Ability to analyze and interpret sustainability data for applying decision-making",
    "Capacity to communicate sustainability concepts to diverse stakeholders",
    "Skill in applying sustainable development frameworks in digital contexts"
  ],
  "target_ects": 60,
  "assessment_methods": [
    "practical_assignments",
    "portfolio",
    "skills_demonstrations"
  ],
  "career_pathways": [
    "Circular IT Implementation Lead",
    "Green Technology Assessment Lead",
    "Chief Green Technology Officer",
    "Sustainable Technology Research Lead",
    "Sustainable Innovation Entrepreneur",
    "Sustainability Educator/Trainer"
  ]
}